Case Number,INC_DATE,TOD,Start of Hour,INC_TIME,Day Name,Month Name,BLOCK,Location,Incident Type_1,ALL_INCIDENTS,Incident Type_2,Incident Type_3,FullAddress,Grid,Zone,Narrative,Total Value Stolen,Total Value Recover,Registration 1,Make1,Model1,Reg State 1,Registration 2,Reg State 2,Make2,Model2,Reviewed By,CompleteCalc,Officer of Record,Squad,Det_Assigned,Case_Status,NIBRS Classification,CASE_NUMBER_LENGTH,Incident Date,Incident Time,Incident Date_Between,Incident Time_Between,Report Date,Report Time,Year,Week of Year,Week of Month,Day,Day of Year,INC_DATE_AND_TIME,St#,Notes,VEHICLE,Suspect,TOTAL_STOLEN_AMOUNT,REPORT_CYCLE,TIME_OF_DAY
25-000813,01/03/25,20:00-23:59 Night,21:00,21:30,Friday,January,"Lookout Ave, 300 Block",309 Lookout Avenue,Motor Vehicle Theft,Motor Vehicle Theft,,,"309 Lookout Avenue, Hackensack, NJ, 07601",I2,9,"On Saturday, January 4th, 2025, I responded to the listed location on a report of a motor vehicle theft. Upon arrival, I met the registered owner, who reported that his vehicle was parked in the driveway at 21:30 hours on 01/03/2025. He further reported that he left his residence with his friends in his friend's vehicle and returned to his residence on the morning of 01/04/2025. He noticed his vehicle was taken from his driveway. The registered owner reported there was nothing valuable in the car and was uncertain if the spare keys were in the vehicle. Both New Jersey plates are affixed to the vehicle.      Communications advised me that the vehicle was located in Clarkstown, NY, and was involved in a motor vehicle hit-and-run accident. The registered owner was also advised of the vehicle's location. I observed no cameras in the area.      The victim did not want the vehicle processed or to sign complaints if the suspect(s) are identified.     A New Jersey Victim Notification form was completed and provided to the registered owner.     An ATTF entry was completed    A motor vehicle checklist was completed and submitted.",,,W46ULY,HONDA,ACC,NJ,,,,,Klosk_J,Complete,P.O. Nicholas Mazzaccaro 377,B4,Det. Robert Ghirardi 150,Active/Administratively Closed,240 = Theft of Motor Vehicle,9,01/03/25,21:30,01/04/25,06:25,01/04/25,10:59,2025,01,01,03,003,01/03/25 21:30,309,"On Saturday, January 4th, 2025, I responded to the listed location on a report of a motor vehicle theft. Upon arrival, I met the registered owner, who reported that his vehicle was parked in the driveway at 21:30 hours on 01/03/2025. He further reported that he left his residence with his friends in his friend's vehicle and returned to his residence on the morning of 01/04/2025. He noticed his vehicle was taken from his driveway. The registered owner reported there was nothing valuable in the car and was uncertain if the spare keys were in the vehicle. Both New Jersey plates are affixed to the vehicle.      Communications advised me that the vehicle was located in Clarkstown, NY, and was involved in a motor vehicle hit-and-run accident. The registered owner was also advised of the vehicle's location. I observed no cameras in the area.      The victim did not want the vehicle processed or to sign complaints if the suspect(s) are identified.     A New Jersey Victim Notification form was completed and provided to the registered owner.     An ATTF entry was completed    A motor vehicle checklist was completed and submitted.","Vehicle 1: NJ-W46ULY HONDA, ACC",suspect(s) are identified,,C01W01,Night (20:00-23:59)
25-002635,01/06/25,12:00-15:59 Afternoon,15:00,15:30,Monday,January,"Prospect Ave, 0 Block",90 Prospect Avenue,Burglary - Auto,Burglary - Auto,,,"90 Prospect Avenue, Hackensack, NJ, 07601",,7,"Suspect(s): Unknown.     I responded to the listed location, 90 Prospect Avenue, on a report of a burglary to auto. Upon arrival, I was met by the victim, Kelly Nurnberg-Darzi, who stated on the morning of 01/10/25 she responded to her grey 2006 Honda Pilot and observed all of her work equipment to be missing. The victim advised me she specialized in opening safes and stores several of her high-value tools in the rear of the listed vehicle. The victim stated the listed vehicle was parked in assigned space #20 and did not move it from the assigned space. The victim stated she last recalled observing her tools in the listed vehicle on 01/06/25 and had not returned to the vehicle since. The following items were taken from the listed vehicle:2 Boroscope - $5,000.00 USD8 Redundant Locks - $2,000.00 USD5 Drills - $5,000.00 USD1 large box of drill bits - $1,200.00 USD1 tool bag with several tools - $2,000.00 USD6 Electronic locks - $1,320.00 USD4 FAS locks - $480.00 Total Value - $17,000.00 USD     While on scene, I observed several cameras in the parking garage of 90 Prospect Avenue. I further observed the listed vehicle to have a broken rear passenger side window which gives direct access to the vehicles trunk. The victim stated the damage occurred on 01/04/25 while her son was parking the vehicle. The victim further stated she did not have any time to repair the broken window and remove the tools from the vehicle prior to them being taken.      The victim advised me she believes the suspect may be her husband Uri Darzi whom she is currently in a civil lawsuit with. Sgt. Peralta responded assist.A victim notification form was completed and a copy was given to the victim.",,,XCSW43,HONDA,PIL,NJ,,,,,Deleon_A,Complete,P.O. Ruben Almonte 359,A3,Det. Matthew DeBonis 325,Active/Administratively Closed,23F = Theft From Motor Vehicle,9,01/06/25,15:30,01/10/25,,01/10/25,19:49,2025,02,02,06,006,01/06/25 15:30,90,"Suspect(s): Unknown.     I responded to the listed location, 90 Prospect Avenue, on a report of a burglary to auto. Upon arrival, I was met by the victim, Kelly Nurnberg-Darzi, who stated on the morning of 01/10/25 she responded to her grey 2006 Honda Pilot and observed all of her work equipment to be missing. The victim advised me she specialized in opening safes and stores several of her high-value tools in the rear of the listed vehicle. The victim stated the listed vehicle was parked in assigned space #20 and did not move it from the assigned space. The victim stated she last recalled observing her tools in the listed vehicle on 01/06/25 and had not returned to the vehicle since. The following items were taken from the listed vehicle:2 Boroscope - $5,000.00 USD8 Redundant Locks - $2,000.00 USD5 Drills - $5,000.00 USD1 large box of drill bits - $1,200.00 USD1 tool bag with several tools - $2,000.00 USD6 Electronic locks - $1,320.00 USD4 FAS locks - $480.00 Total Value - $17,000.00 USD     While on scene, I observed several cameras in the parking garage of 90 Prospect Avenue. I further observed the listed vehicle to have a broken rear passenger side window which gives direct access to the vehicles trunk. The victim stated the damage occurred on 01/04/25 while her son was parking the vehicle. The victim further stated she did not have any time to repair the broken window and remove the tools from the vehicle prior to them being taken.      The victim advised me she believes the suspect may be her husband Uri Darzi whom she is currently in a civil lawsuit with. Sgt. Peralta responded assist.A victim notification form was completed and a copy was given to the victim.","Vehicle 1: NJ-XCSW43 HONDA, PIL",suspect(s): unknown suspect may be her husband uri darzi whom she is currently in a civil lawsuit with,"$5,000.00 USD8 Redundant Locks -  $2,000.00 USD5 Drills -  $5,000.00 USD1 large box of drill bits -  $1,200.00 USD1 tool bag with several tools -  $2,000.00 USD6 Electronic locks -  $1,320.00 USD4 FAS locks -  $480.00 Total Value -  $17,000.00 USD     While on scene, I observed several cameras in the parking garage of 90 Prospect Avenue. I further observed the listed vehicle to have a broken rear passenger side window which gives direct access to the vehicles trunk",C01W01,Afternoon (12:00-15:59)
25-002564,01/07/25,12:00-15:59 Afternoon,14:00,14:00,Tuesday,January,"First St, 100 Block",135 First Street,Criminal Sexual Contact,"Criminal Sexual Contact, Juvenile Investigation",Juvenile Investigation,,"135 First Street, Hackensack, NJ, 07601",G3,7,"On Friday January 10, 2025, I was assigned as the Hackensack High School SRO. I was advised that a student wanted to report a crime and was currently in the main office. Upon arriving to the main office I met the victim, A.R.       As I began to speak with the victim she immediately began to cry. She stated that she was inappropriately touched by the suspect who is also student. The suspect was identified as Manuel Martinez Perez. The victim stated that on Tuesday January 7, 2025  she was in her 9th period class ESL 2 in room 276. She shares this class with the suspect and his cousin Esmeralda Perez Martinez who is a potential witness.       The victim stated during class the suspect gave her a hug. As he was hugging her he dropped his hand down and grabbed her breast over her clothing. She immediately became angry and told him not to touch her. She then advised Esmeralda Perez Martinez that she was touched inappropriately by the suspect. The victim stated that she reported this incident to her her teacher Mrs. Magdalene Symmonds, but she did not understand her due to a language barrier.  The victim reported that this was not the first time she was inappropriately touched by the suspect. She reported that the prior week a similar incident occurred. I notified assistant Principal Celso King of this report.      I spoke to Esmeralda Perez Martinez who may have witness the incident. Perez Martinez stated that she sits in a group with the victim and the suspect. The day of the incident she did not observe the suspect touch the victim because she was busy doing her class work. The witness did confirm that the victim mentioned to her that she was inappropriately touched by the suspect.       The victim's mother, Raquel Lelio, was notified of the incident and responded to the school. She advised me that she was not sure if she wanted to sign criminal complaints against the suspect. She wants to speak with her daughter and husband before making a decision.       Det. E. Reyes was advised of the incident and will follow up with the complainant at a later time.",,,,,,,,,,,Dominguez_L,Complete,Det. Cristobal Lara-Nunez 341,STA,Det. Evelyn Reyes 336,Active/Administratively Closed,11D = Fondling,9,01/07/25,14:00,,,01/10/25,14:20,2025,02,02,07,007,01/07/25 14:00,135,"On Friday January 10, 2025, I was assigned as the Hackensack High School SRO. I was advised that a student wanted to report a crime and was currently in the main office. Upon arriving to the main office I met the victim, A.R.       As I began to speak with the victim she immediately began to cry. She stated that she was inappropriately touched by the suspect who is also student. The suspect was identified as Manuel Martinez Perez. The victim stated that on Tuesday January 7, 2025  she was in her 9th period class ESL 2 in room 276. She shares this class with the suspect and his cousin Esmeralda Perez Martinez who is a potential witness.       The victim stated during class the suspect gave her a hug. As he was hugging her he dropped his hand down and grabbed her breast over her clothing. She immediately became angry and told him not to touch her. She then advised Esmeralda Perez Martinez that she was touched inappropriately by the suspect. The victim stated that she reported this incident to her her teacher Mrs. Magdalene Symmonds, but she did not understand her due to a language barrier.  The victim reported that this was not the first time she was inappropriately touched by the suspect. She reported that the prior week a similar incident occurred. I notified assistant Principal Celso King of this report.      I spoke to Esmeralda Perez Martinez who may have witness the incident. Perez Martinez stated that she sits in a group with the victim and the suspect. The day of the incident she did not observe the suspect touch the victim because she was busy doing her class work. The witness did confirm that the victim mentioned to her that she was inappropriately touched by the suspect.       The victim's mother, Raquel Lelio, was notified of the incident and responded to the school. She advised me that she was not sure if she wanted to sign criminal complaints against the suspect. She wants to speak with her daughter and husband before making a decision.       Det. E. Reyes was advised of the incident and will follow up with the complainant at a later time.",,suspect who is also student suspect was identified as manuel martinez perez suspect and his cousin esmeralda perez martinez who is a potential witness suspect gave her a hug suspect suspect suspect suspect touch the victim because she was busy doing her class work suspect suspect,,C01W02,Afternoon (12:00-15:59)
25-003362,01/13/25,12:00-15:59 Afternoon,12:00,12:05,Monday,January,"Clay St, 200 Block",204 Clay Street,Dispute,"Dispute, Criminal Attempt, Robbery",Criminal Attempt,Robbery,"204 Clay Street, Hackensack, NJ, 07601",H3,8,"On Monday, January 13th, 2025, at approximately 12:07 hours, P.O. Alvarez and I responded to the listed location on a dispute report. Before our arrival, headquarters had advised us that the male suspect, described as wearing a grey hoodie and sweatpants, had fled southbound on First Street. Upon arrival, we met with Maria Romero Peralta, the mother of the juvenile victim, A.R.      She reported that the described suspect, later identified as D.T., had punched her in the left eye and her right breast. With the mother's permission and in her presence, we spoke to the victim, a juvenile male, A.R., who reported that the suspect, D.T., had stolen a red electronic moped bike and had dropped it off at his house. He further reported that the suspect asked the victim if he could drop off the stolen moped for a couple of days. The victim also reported giving the stolen moped bike to another friend since he did not know how to operate the bike. A.R. later noted that the suspect, D.T., recovered the stolen moped bike from the said friend they have in common and had the bike confiscated byLaw Enforcement in another jurisdiction.      Today, the victim reported that the suspect arrived at his residence demanding $400.00 for the moped because it had been confiscated. He further reported that the suspect arrived with three (3) other friends: two Hispanic males, unknown names, dates of birth, or addresses, and a Hispanic female, blonde hair and blue jacket, operating a Toyota Rav 4 with an unknown NY tag. He also reported that a fight ensued between him and the suspect, and the three (3) witnesses stood by.      The victim also reported that his mother, Maria Romero Peralta, heard the commotion and broke up the fight, retreating with the victim and herself back into the residence. A.R. reported that the front entrance door closed and was being held by his mother when the suspect breached the door with physical force and continued to assault the victim while demanding $400.00 for the red moped electric bike.  I then requested a supervisor, and Sgt. Williams responded to assist.     Maria Romero Peralta reported that while attempting to break up the fight, she was punched in the left eye and right breast by the suspect, D.T. She also reported that the suspect and the three (3) witnesses fled the scene after she threatened to call the police. Maria Romero Peralta, along with A.R. declined medical attention at the scene. The mother and the victim wanted to provide statements to detectives and were transported to headquarters by P.O. Alvarez as I followed.      At headquarters, Detectives Mora and Garrett responded to report room 2 and met with the victim and his mother. Before providing statements to the detectives, Maria Romero Peralta began to have complaints of pain in her left eye and right breast. I observed her left eye to be swollen and red. Maria Romero Peralta then requested to be transported to the hospital for evaluation and treatment. I requested an ambulance, and Hackensack University Medical Center BLS #136 arrived. The mother, now a patient, was transported to the HUMC along with A.R. for treatment. The patient reported that she would respond to headquarters at a later time to provide statements to the detectives. I contacted DCP&P Christine #1718 and advised of the incident. She reported that the incident would only be documented. I completed a victim notification form and provided a copy to the victim.It should be noted that the victim, A.R., reported that he had dropped out of school as of today; therefore, a handle with care was not completed. See Detectives report for additional information.",,,,,,,,,,,Klosk_J,Complete,P.O. Forrod Bonsu 353,B1,Det. Frankie Garrett 323,Active Investigation,120 = Robbery,9,01/13/25,12:05,,,01/13/25,12:07,2025,03,03,13,013,01/13/25 12:05,204,"On Monday, January 13th, 2025, at approximately 12:07 hours, P.O. Alvarez and I responded to the listed location on a dispute report. Before our arrival, headquarters had advised us that the male suspect, described as wearing a grey hoodie and sweatpants, had fled southbound on First Street. Upon arrival, we met with Maria Romero Peralta, the mother of the juvenile victim, A.R.      She reported that the described suspect, later identified as D.T., had punched her in the left eye and her right breast. With the mother's permission and in her presence, we spoke to the victim, a juvenile male, A.R., who reported that the suspect, D.T., had stolen a red electronic moped bike and had dropped it off at his house. He further reported that the suspect asked the victim if he could drop off the stolen moped for a couple of days. The victim also reported giving the stolen moped bike to another friend since he did not know how to operate the bike. A.R. later noted that the suspect, D.T., recovered the stolen moped bike from the said friend they have in common and had the bike confiscated byLaw Enforcement in another jurisdiction.      Today, the victim reported that the suspect arrived at his residence demanding $400.00 for the moped because it had been confiscated. He further reported that the suspect arrived with three (3) other friends: two Hispanic males, unknown names, dates of birth, or addresses, and a Hispanic female, blonde hair and blue jacket, operating a Toyota Rav 4 with an unknown NY tag. He also reported that a fight ensued between him and the suspect, and the three (3) witnesses stood by.      The victim also reported that his mother, Maria Romero Peralta, heard the commotion and broke up the fight, retreating with the victim and herself back into the residence. A.R. reported that the front entrance door closed and was being held by his mother when the suspect breached the door with physical force and continued to assault the victim while demanding $400.00 for the red moped electric bike.  I then requested a supervisor, and Sgt. Williams responded to assist.     Maria Romero Peralta reported that while attempting to break up the fight, she was punched in the left eye and right breast by the suspect, D.T. She also reported that the suspect and the three (3) witnesses fled the scene after she threatened to call the police. Maria Romero Peralta, along with A.R. declined medical attention at the scene. The mother and the victim wanted to provide statements to detectives and were transported to headquarters by P.O. Alvarez as I followed.      At headquarters, Detectives Mora and Garrett responded to report room 2 and met with the victim and his mother. Before providing statements to the detectives, Maria Romero Peralta began to have complaints of pain in her left eye and right breast. I observed her left eye to be swollen and red. Maria Romero Peralta then requested to be transported to the hospital for evaluation and treatment. I requested an ambulance, and Hackensack University Medical Center BLS #136 arrived. The mother, now a patient, was transported to the HUMC along with A.R. for treatment. The patient reported that she would respond to headquarters at a later time to provide statements to the detectives. I contacted DCP&P Christine #1718 and advised of the incident. She reported that the incident would only be documented. I completed a victim notification form and provided a copy to the victim.It should be noted that the victim, A.R., reported that he had dropped out of school as of today; therefore, a handle with care was not completed. See Detectives report for additional information.",,"suspect, described as wearing a grey hoodie and sweatpants, had fled southbound on first street suspect, later identified as d suspect, d suspect asked the victim if he could drop off the stolen moped for a couple of days suspect, d suspect arrived at his residence demanding $400 suspect arrived with three (3) other friends: two hispanic males, unknown names, dates of birth, or addresses, and a hispanic female, blonde hair and blue jacket, operating a toyota rav 4 with an unknown ny tag suspect, and the three (3) witnesses stood by suspect breached the door with physical force and continued to assault the victim while demanding $400 suspect, d suspect and the three (3) witnesses fled the scene after she threatened to call the police","$400.00 for the moped because it had been confiscated. He further reported that the suspect arrived with three (3) other friends: two Hispanic males, unknown names, dates of birth, or addresses, and a Hispanic female, blonde hair and blue jacket, operating a Toyota Rav 4 with an unknown NY tag $400.00 for the red moped electric bike.  I then requested a supervisor, and Sgt",C01W02,Afternoon (12:00-15:59)
