Case Number,INC_DATE,TOD,Start of Hour,INC_TIME,Day Name,Month Name,BLOCK,Location,Incident Type_1,ALL_INCIDENTS,Incident Type_2,Incident Type_3,FullAddress,Grid,Zone,Narrative,Total Value Stolen,Total Value Recover,Registration 1,Make1,Model1,Reg State 1,Registration 2,Reg State 2,Make2,Model2,Reviewed By,CompleteCalc,Officer of Record,Squad,Det_Assigned,Case_Status,NIBRS Classification,CASE_NUMBER_LENGTH,Incident Date,Incident Time,Incident Date_Between,Incident Time_Between,Report Date,Report Time,Year,Week of Year,Week of Month,Day,Day of Year,INC_DATE_AND_TIME,St#,Notes,VEHICLE,Suspect,TOTAL_STOLEN_AMOUNT,REPORT_CYCLE,TIME_OF_DAY
25-009657,02/03/25,16:00-19:59 Evening Peak,18:00,18:30,Monday,February,"Midtown Bridge Approach, 0 Block",55 Midtown Bridge Approach,Motor Vehicle Theft,Motor Vehicle Theft,,,"55 Midtown Bridge Approach, Hackensack, NJ, 07601",H1,8,"I responded to the listed location on a reported motor vehicle theft. Upon arrival, I spoke with the complainant. She stated that on 02/04/2025 at 11:29 hours, she received a text from her boss, asking her to check on one of their U-Haul vehicles. She further stated that upon searching the parking lot, she could not locate the vehicle. The complainant reported that the vehicle had been rented out, so she contacted the contract holder to ensure the vehicle was dropped off. Upon verifying such and checking camera footage, the vehicle is seen on camera being dropped off by the customer. He is then approached by the suspect, where a brief verbal exchange is had. The customer is then seen leaving the area. The suspect is then seen retrieving keys from a lock box, before entering the van and fleeing the area.     I then spoke with the customer. He stated that he had dropped the vehicle off at the listed location at approximately 18:40 hours. He further stated that upon dropping it off, he was greeted by the suspect, who acted as an employee of the business. The customer reported that after a brief discussion, he was wary of the suspect and secured the keys in the lock box himself. He further stated that he then left the area.       A check in house of our tow list was conducted, with the vehicle not having been reported as towed or repossessed.  The complainant was advised of the recovery process, including fingerprinting of the vehicle. The complainant stated that she would like the vehicle held for prints on behalf of U-Haul and signed a Consent to Search Form. The complainant advised that she was unsure if the vehicle had a tracking system.       The vehicle is valued at approximately $45,000.00.            The complainant has video footage of the incident, available upon request.       Vehicle was entered into the ATTF website.    A New Jersey Victim Notification Form was completed.Insurance Info: Self-InsuredCertificate #:S012Exp: 06/30/2025",,,AM82732,RAM,PROMASTER,AZ,,,,,Deleon_A,Complete,P.O. Micah Gibson 365,A3,Det. Matthew DeBonis 325,Complaint Signed,240 = Theft of Motor Vehicle,9,02/03/25,18:30,02/04/25,19:00,02/04/25,12:43,2025,06,02,03,034,02/03/25 18:30,55,"I responded to the listed location on a reported motor vehicle theft. Upon arrival, I spoke with the complainant. She stated that on 02/04/2025 at 11:29 hours, she received a text from her boss, asking her to check on one of their U-Haul vehicles. She further stated that upon searching the parking lot, she could not locate the vehicle. The complainant reported that the vehicle had been rented out, so she contacted the contract holder to ensure the vehicle was dropped off. Upon verifying such and checking camera footage, the vehicle is seen on camera being dropped off by the customer. He is then approached by the suspect, where a brief verbal exchange is had. The customer is then seen leaving the area. The suspect is then seen retrieving keys from a lock box, before entering the van and fleeing the area.     I then spoke with the customer. He stated that he had dropped the vehicle off at the listed location at approximately 18:40 hours. He further stated that upon dropping it off, he was greeted by the suspect, who acted as an employee of the business. The customer reported that after a brief discussion, he was wary of the suspect and secured the keys in the lock box himself. He further stated that he then left the area.       A check in house of our tow list was conducted, with the vehicle not having been reported as towed or repossessed.  The complainant was advised of the recovery process, including fingerprinting of the vehicle. The complainant stated that she would like the vehicle held for prints on behalf of U-Haul and signed a Consent to Search Form. The complainant advised that she was unsure if the vehicle had a tracking system.       The vehicle is valued at approximately $45,000.00.            The complainant has video footage of the incident, available upon request.       Vehicle was entered into the ATTF website.    A New Jersey Victim Notification Form was completed.Insurance Info: Self-InsuredCertificate #:S012Exp: 06/30/2025","Vehicle 1: AZ-AM82732 RAM, PROMASTER","suspect, where a brief verbal exchange is had suspect is then seen retrieving keys from a lock box, before entering the van and fleeing the area suspect, who acted as an employee of the business suspect and secured the keys in the lock box himself","$45,000.00.            The complainant has video footage of the incident, available upon request",C02W05,Evening Peak (16:00-19:59)
25-009831,02/05/25,00:00-03:59 Early Morning,02:00,02:57,Wednesday,February,"Passaic St, 400 Block",441 Passaic Street,Burglary - Commercial,"Burglary - Commercial, Alarm - Burglar",Alarm - Burglar,,"441 Passaic Street, Hackensack, NJ, 07601",H5,8,"On Wednesday, February 5, 2025 at approximately 0300 hours,  P.O Dominguez and I responded to Hackensack Pharmacy (441 Passaic Street) on a reported activated burglar alarm.   Upon my arrival, I observed the main entrance glass door located on the north side of the business to be shattered.  I also observed a master lock and a metal pin on the ground near the door that appeared to had been cut off the steel roller gate located in front of the glass door. I also observed a white prescription pill bottle on the ground near the master lock.  I advised police communications of my findings and P.O A. Lopez , P.O N. Marza and P.O Mattalian arrived to assist.  A perimeter of the business was immediately established.  P.O Dominguez, P.O N. Marza and I made entry into the business and completed an interior check.  The interior check yielded negative results for any person(s) in the business.  While completing the interior check, I observed two gray large paver stones on the floor near the front glass door.  It appears the two stones were used to break the glass to the front door to gain access.  I observed several white prescription pill bottles on the floor as well as several pairs of eye glasses.  Upon further inspection, I observed a white wooden cabinet located behind the service counter that appeared to have been broken into which contained several white prescription pill bottles similar to the prescription pill bottle located outside on the ground in front of the business.  P.O Dominguez made notification to the tour commander. At approximately 0445 hours, Det. Scarpa and the business owner, Mr. Bodawala, arrived and were updated.  Mr. Bodawala consented to the business to be processed and signed a Consent to Search form.  Mr. Bodawala showed video footage of the incident to Det. Scarpa and e-mailed the footage to Det. Scarpa.  See Det. Scarpa's Supplemental report for further. At 0315 hours, the scene was preserved and a crime log had commenced.-0448 hours, Det. N. LaSala (BCSD-CSU) arrived to process the scene, BCSD case # 2025-0088.-0528 hours, Det. N. LaSala completed processing the scene. The scene was turned over to Mr. Bodawala. Mr. Bodawala advised it is unknown what proceeds/value were taken at this time. He advised once he and his employee conduct and complete an inventory, he will compile a list and forward it to Det. Scarpa. Case turned over to Det. Scarpa.",,,,,,,,,,,Swetits_M,Complete,P.O. Benjamin Estrada 350,A2,Det. Frank Scarpa 348,Active Investigation,220 = Burglary/Breaking & Entering,9,02/05/25,02:57,,,02/05/25,02:57,2025,06,02,05,036,02/05/25 02:57,441,"On Wednesday, February 5, 2025 at approximately 0300 hours,  P.O Dominguez and I responded to Hackensack Pharmacy (441 Passaic Street) on a reported activated burglar alarm.   Upon my arrival, I observed the main entrance glass door located on the north side of the business to be shattered.  I also observed a master lock and a metal pin on the ground near the door that appeared to had been cut off the steel roller gate located in front of the glass door. I also observed a white prescription pill bottle on the ground near the master lock.  I advised police communications of my findings and P.O A. Lopez , P.O N. Marza and P.O Mattalian arrived to assist.  A perimeter of the business was immediately established.  P.O Dominguez, P.O N. Marza and I made entry into the business and completed an interior check.  The interior check yielded negative results for any person(s) in the business.  While completing the interior check, I observed two gray large paver stones on the floor near the front glass door.  It appears the two stones were used to break the glass to the front door to gain access.  I observed several white prescription pill bottles on the floor as well as several pairs of eye glasses.  Upon further inspection, I observed a white wooden cabinet located behind the service counter that appeared to have been broken into which contained several white prescription pill bottles similar to the prescription pill bottle located outside on the ground in front of the business.  P.O Dominguez made notification to the tour commander. At approximately 0445 hours, Det. Scarpa and the business owner, Mr. Bodawala, arrived and were updated.  Mr. Bodawala consented to the business to be processed and signed a Consent to Search form.  Mr. Bodawala showed video footage of the incident to Det. Scarpa and e-mailed the footage to Det. Scarpa.  See Det. Scarpa's Supplemental report for further. At 0315 hours, the scene was preserved and a crime log had commenced.-0448 hours, Det. N. LaSala (BCSD-CSU) arrived to process the scene, BCSD case # 2025-0088.-0528 hours, Det. N. LaSala completed processing the scene. The scene was turned over to Mr. Bodawala. Mr. Bodawala advised it is unknown what proceeds/value were taken at this time. He advised once he and his employee conduct and complete an inventory, he will compile a list and forward it to Det. Scarpa. Case turned over to Det. Scarpa.",,,,C02W06,Early Morning (00:00-03:59)
25-010474,02/07/25,04:00-07:59 Morning,06:00,06:35,Friday,February,"Hudson St, 100 Block",170 Hudson Street,Motor Vehicle Theft,Motor Vehicle Theft,,,"170 Hudson Street, Hackensack, NJ, 07601",E2,5,"I responded to the listed location on a motor vehicle theft. Upon arrival, I met with the complainant and the victim. The victim only spoke Spanish, so her husband (the complainant) translated. The complainant stated that his wife's vehicle was parking in the driveway of 170 Hudson Street, which was located between 170 Hudson Street and 166 Hudson Street. He stated that he left his vehicle running and went back into his house at 0635 hours. When he went to check on the vehicle at 0650 hours, he discovered it was missing. The vehicle was left unlocked with the keys in the ignition. I observed cameras in the rear of the house, but none located directly where the vehicle was parked.A victim notification form was completed and a copy was given to the victim. The victim requested to have the vehicle process if located. The estimated value of the stolen auto is $2,000.00 Dollars.",,,T12SSE,DODGE,CAR,NJ,,,,,Swetits_M,Complete,P.O. Matthew Tedesco 316,B3,Sgt. Francesco Tripodi 134,No Investigation,240 = Theft of Motor Vehicle,9,02/07/25,06:35,02/07/25,06:50,02/07/25,07:22,2025,06,02,07,038,02/07/25 06:35,170,"I responded to the listed location on a motor vehicle theft. Upon arrival, I met with the complainant and the victim. The victim only spoke Spanish, so her husband (the complainant) translated. The complainant stated that his wife's vehicle was parking in the driveway of 170 Hudson Street, which was located between 170 Hudson Street and 166 Hudson Street. He stated that he left his vehicle running and went back into his house at 0635 hours. When he went to check on the vehicle at 0650 hours, he discovered it was missing. The vehicle was left unlocked with the keys in the ignition. I observed cameras in the rear of the house, but none located directly where the vehicle was parked.A victim notification form was completed and a copy was given to the victim. The victim requested to have the vehicle process if located. The estimated value of the stolen auto is $2,000.00 Dollars.","Vehicle 1: NJ-T12SSE DODGE, CAR",,"$2,000.00 Dollars.",C02W06,Morning (04:00-07:59)
25-012110,02/13/25,00:00-03:59 Early Morning,02:00,02:00,Thursday,February,"Christopher Columbus Drive, 100 Block",128 Christopher Columbus Drive,Assist Other Agency,"Assist Other Agency, Aggravated Assault, Robbery",Aggravated Assault,Robbery,"128 Christopher Columbus Drive, Jersey City, NJ 07302, Hackensack, NJ, 07601",I5,9,"Victim and suspect were in a dating relationship for approximately 9 months.    I responded to Police Headquarters on a report of Domestic Violence. Upon arrival I met with the Victim who stated on 02/13/2025 at approximately 0200 hours she was at a bar called ""Six26"" in Jersey City, NJ (128 Christopher Columbus Drive, Jersey City, NJ 07302.) She stated while she was leaving the bar, the suspect met with her on the sidewalk. The victim stated the suspect wished to get back together, but she refused. He then became angry and proceeded to strangle her, briefly cutting off her ability to breath, however she did not lose consciousness. Right after the suspect strangled her, he stole her Iphone 14 Pro out of her front pocket (Approximate value: $1,000.00) then fled the scene.     The victim advised me that she currently has a restraining order against the suspect, but he has not been served. Docket number: FV-BER-002857-24.A recorded statement was taken by Detective Mora. BREATHE services were offered but the victim refused. A New Jersey Victim Notification Form was completed.DVRT Form was completed.Voluntary Handwritten Statement was completed.ODARA Form was completed. Jersey City Police Department Detective Soto was advised of the incident.All paperwork was forwarded to him for complaints to be signed.",,,,,,,,,,,Briggs_S,Complete,P.O. Angelo Vicale 370,B3,Det. John Mora 257,TOT Outside Jurisdiction,,9,02/13/25,02:00,,,02/13/25,12:17,2025,07,03,13,044,02/13/25 02:00,128,"Victim and suspect were in a dating relationship for approximately 9 months.    I responded to Police Headquarters on a report of Domestic Violence. Upon arrival I met with the Victim who stated on 02/13/2025 at approximately 0200 hours she was at a bar called ""Six26"" in Jersey City, NJ (128 Christopher Columbus Drive, Jersey City, NJ 07302.) She stated while she was leaving the bar, the suspect met with her on the sidewalk. The victim stated the suspect wished to get back together, but she refused. He then became angry and proceeded to strangle her, briefly cutting off her ability to breath, however she did not lose consciousness. Right after the suspect strangled her, he stole her Iphone 14 Pro out of her front pocket (Approximate value: $1,000.00) then fled the scene.     The victim advised me that she currently has a restraining order against the suspect, but he has not been served. Docket number: FV-BER-002857-24.A recorded statement was taken by Detective Mora. BREATHE services were offered but the victim refused. A New Jersey Victim Notification Form was completed.DVRT Form was completed.Voluntary Handwritten Statement was completed.ODARA Form was completed. Jersey City Police Department Detective Soto was advised of the incident.All paperwork was forwarded to him for complaints to be signed.",,"suspect were in a dating relationship for approximately 9 months suspect met with her on the sidewalk suspect wished to get back together, but she refused suspect strangled her, he stole her iphone 14 pro out of her front pocket (approximate value: $1,000 suspect, but he has not been served","$1,000.00) then fled the scene.     The victim advised me that she currently has a restraining order against the suspect, but he has not been served",C02W07,Early Morning (00:00-03:59)
25-012325,02/13/25,16:00-19:59 Evening Peak,16:00,16:00,Thursday,February,East Pleasantview Avenue & Kipp Street,East Pleasantview Avenue & Kipp Street,Burglary - Auto,Burglary - Auto,,,"East Pleasantview Avenue & Kipp Street, Hackensack, NJ, 07601",F3,6,"I responded to East Pleasantview and Kipp St. on a burglary to auto. Upon arrival I met with the complainant, Mr. Santangelo who is an employee of PSE&G. He stated that he parked and locked his work vehicle (NJ-XGDR55) on 2/13/25 at approximately 1600 hours then returned on 2/14/25 at 0710 hours and noticed the rear passenger side window was completely shattered.     The window was shattered and the unknown suspect(s) were able to unlock the door from the inside and enter the vehicle. Mr. Santangelo reported numerous tools were stolen. Mr. Santangelo touched the inside of the vehicle prior to my arrival, contaminating it making it unable to be processed. Stolen tools:1-Metro Tech 810 Mark out scope- approximately $3,000.001-Heath RMLD- Approximately $8,000.001-Heath gas detector- Approximately $5,000.00                                            Approximate amount stolen: $16,000.00    I did not observe any cameras in the area and the PSE&G vehicle is self insured.",,,XGDR55,FORD,R1Z,NJ,,,,,Swetits_M,Complete,P.O. Angelo Vicale 370,B3,Det. Demetrius Carroll 133,Active Investigation,23F = Theft From Motor Vehicle,9,02/13/25,16:00,,,02/14/25,07:10,2025,07,03,13,044,02/13/25 16:00,,"I responded to East Pleasantview and Kipp St. on a burglary to auto. Upon arrival I met with the complainant, Mr. Santangelo who is an employee of PSE&G. He stated that he parked and locked his work vehicle (NJ-XGDR55) on 2/13/25 at approximately 1600 hours then returned on 2/14/25 at 0710 hours and noticed the rear passenger side window was completely shattered.     The window was shattered and the unknown suspect(s) were able to unlock the door from the inside and enter the vehicle. Mr. Santangelo reported numerous tools were stolen. Mr. Santangelo touched the inside of the vehicle prior to my arrival, contaminating it making it unable to be processed. Stolen tools:1-Metro Tech 810 Mark out scope- approximately $3,000.001-Heath RMLD- Approximately $8,000.001-Heath gas detector- Approximately $5,000.00                                            Approximate amount stolen: $16,000.00    I did not observe any cameras in the area and the PSE&G vehicle is self insured.","Vehicle 1: NJ-XGDR55 FORD, R1Z",suspect(s) were able to unlock the door from the inside and enter the vehicle,"$3,000.001-Heath RMLD- Approximately  $8,000.001-Heath gas detector- Approximately  $5,000.00                                            Approximate amount stolen:  $16,000.00    I did not observe any cameras in the area and the PSE&G vehicle is self insured.",C02W07,Evening Peak (16:00-19:59)
