Case Number,INC_DATE,TOD,Start of Hour,INC_TIME,Day Name,Month Name,BLOCK,Location,Incident Type_1,ALL_INCIDENTS,Incident Type_2,Incident Type_3,FullAddress,Grid,Zone,Narrative,Total Value Stolen,Total Value Recover,Registration 1,Make1,Model1,Reg State 1,Registration 2,Reg State 2,Make2,Model2,Reviewed By,CompleteCalc,Officer of Record,Squad,Det_Assigned,Case_Status,NIBRS Classification,CASE_NUMBER_LENGTH,Incident Date,Incident Time,Incident Date_Between,Incident Time_Between,Report Date,Report Time,Year,Week of Year,Week of Month,Day,Day of Year,INC_DATE_AND_TIME,St#,Notes,VEHICLE,Suspect,TOTAL_STOLEN_AMOUNT,REPORT_CYCLE,TIME_OF_DAY
25-004478,01/16/25,12:00-15:59 Afternoon,12:00,12:00,Thursday,January,"Second St, 0 Block",30 Second Street,Burglary - Residence,Burglary - Residence,,,"30 Second Street, Hackensack, NJ, 07601",G3,7,"On Thursday, January 16, 2025 at approximately 1934 hours, Sgt. Peralta and I responded to 30 Second Street, Apt. L1 on report of a residential burglary. Upon arrival, I met with the victim who reported that she left her apartment at approximately 1200 hours on this date, before returning several hours later, at approximately 1800 hours. The victim further reported that upon returning to her apartment, she observed the exterior door knob to be damaged (loose), as if someone attempted to break in. The victim stated that upon entering the apartment, the interior did not appear to be ransacked, nor did anything appear out of place at this time.      The scene was unable to processed due to the victim contaminating evidence while entering her apartment. The cost of repair for the damaged door knob was approximately $35.00. A Victim Notification was completed and the victim was provided with a copy upon our departure. There were no known suspects at the time this report was taken. Det./Sgt. Tripodi was notified.",,,,,,,,,,,Deleon_A,Complete,P.O. Aziah Miller 357,A3,Det. Matthew DeBonis 325,Active/Administratively Closed,220 = Burglary/Breaking & Entering,9,01/16/25,12:00,01/16/25,18:00,01/16/25,19:34,2025,03,03,16,016,01/16/25 12:00,30,"On Thursday, January 16, 2025 at approximately 1934 hours, Sgt. Peralta and I responded to 30 Second Street, Apt. L1 on report of a residential burglary. Upon arrival, I met with the victim who reported that she left her apartment at approximately 1200 hours on this date, before returning several hours later, at approximately 1800 hours. The victim further reported that upon returning to her apartment, she observed the exterior door knob to be damaged (loose), as if someone attempted to break in. The victim stated that upon entering the apartment, the interior did not appear to be ransacked, nor did anything appear out of place at this time.      The scene was unable to processed due to the victim contaminating evidence while entering her apartment. The cost of repair for the damaged door knob was approximately $35.00. A Victim Notification was completed and the victim was provided with a copy upon our departure. There were no known suspects at the time this report was taken. Det./Sgt. Tripodi was notified.",,suspects at the time this report was taken,$35.00. A Victim Notification was completed and the victim was provided with a copy upon our departure,C01W03,Afternoon (12:00-15:59)
25-004629,01/16/25,20:00-23:59 Night,21:00,21:03,Thursday,January,"Main St, 600 Block",630 Main Street,Robbery,Robbery,,,"630 Main Street, Hackensack, NJ, 07601",I1,9,"Suspect 1: Hispanic male, approximately early 30' s in age, approximately 5'10"" in height, approximately 180 in weight, wearing a tan hooded sweater, brown ""NY"" Yankees logo hat, black sweatpants and white sneakers.Suspect 2: Hispanic female, approximately mid 20's in age, approximately 5'5"" in height, approximately 140 in weight, wearing a black jacket, grey hooded sweater, tan pants and cream colored shoes. Suspect Vehicle: 4 door Silver in color Hyundai Sonata (unknown registration).On 1/17/25 P.O. Papanikolaou and I responded to 630 Main Street, Target on a reported shoplifting. While   speaking with Target Loss Prevention they wanted to report an additional incident, which occurred in the past.Target Loss Prevention / victim, Cheikh Gaye, reported on 1/16/25 at approximately 21:03 hours suspect 1 and suspect 2 entered Target. It was further reported on 1/16/25 at approximately 21:16 hours suspect 1 and 2 passed all points of sale with unpaid merchandise in a shopping cart. The unpaid merchandise (furniture, grocery, health and beauty, home and kitchen products) totaled $452.71. Prior to exiting Target Loss Prevention / the victim confronted both suspects. Target Loss Prevention were able to recover all merchandise that both suspects attempted to steal. While recovering the stolen merchandise suspect 1 punched the victim in the head, specifically the top left side, with a closed fist one time. The victim reported having a complaint of pain hours after being assaulted. Both suspect later left the area in the suspect vehicle. A Sgt. was requested and Sgt. Competiello responded. Detectives were notified. The victim later responded to headquarters to provide a voluntary statement. The victim refused medical attention at this time.A receipt of the unpaid merchandise was provided by Target Loss Prevention. The receipt was later secured in the Detective Bureau Mailbox.",,,,HYUNDAI,SONATA,,,,,,Deleon_A,Complete,P.O. Massimo Gallorini 379,A2,Det. John Mora 257,Complaint Signed,120 = Robbery,9,01/16/25,21:03,01/16/25,21:16,01/17/25,12:16,2025,03,03,16,016,01/16/25 21:03,630,"Suspect 1: Hispanic male, approximately early 30' s in age, approximately 5'10"" in height, approximately 180 in weight, wearing a tan hooded sweater, brown ""NY"" Yankees logo hat, black sweatpants and white sneakers.Suspect 2: Hispanic female, approximately mid 20's in age, approximately 5'5"" in height, approximately 140 in weight, wearing a black jacket, grey hooded sweater, tan pants and cream colored shoes. Suspect Vehicle: 4 door Silver in color Hyundai Sonata (unknown registration).On 1/17/25 P.O. Papanikolaou and I responded to 630 Main Street, Target on a reported shoplifting. While   speaking with Target Loss Prevention they wanted to report an additional incident, which occurred in the past.Target Loss Prevention / victim, Cheikh Gaye, reported on 1/16/25 at approximately 21:03 hours suspect 1 and suspect 2 entered Target. It was further reported on 1/16/25 at approximately 21:16 hours suspect 1 and 2 passed all points of sale with unpaid merchandise in a shopping cart. The unpaid merchandise (furniture, grocery, health and beauty, home and kitchen products) totaled $452.71. Prior to exiting Target Loss Prevention / the victim confronted both suspects. Target Loss Prevention were able to recover all merchandise that both suspects attempted to steal. While recovering the stolen merchandise suspect 1 punched the victim in the head, specifically the top left side, with a closed fist one time. The victim reported having a complaint of pain hours after being assaulted. Both suspect later left the area in the suspect vehicle. A Sgt. was requested and Sgt. Competiello responded. Detectives were notified. The victim later responded to headquarters to provide a voluntary statement. The victim refused medical attention at this time.A receipt of the unpaid merchandise was provided by Target Loss Prevention. The receipt was later secured in the Detective Bureau Mailbox.","Vehicle 1: HYUNDAI, SONATA","suspect 1: hispanic male, approximately early 30' s in age, approximately 5'10"" in height, approximately 180 in weight, wearing a tan hooded sweater, brown ""ny"" yankees logo hat, black sweatpants and white sneakers suspect 2: hispanic female, approximately mid 20's in age, approximately 5'5"" in height, approximately 140 in weight, wearing a black jacket, grey hooded sweater, tan pants and cream colored shoes suspect vehicle: 4 door silver in color hyundai sonata (unknown registration) suspect 1 and  suspect 2 entered target suspect 1 and 2 passed all points of sale with unpaid merchandise in a shopping cart suspects suspects attempted to steal suspect 1 punched the victim in the head, specifically the top left side, with a closed fist one time suspect later left the area in the  suspect vehicle",$452.71. Prior to exiting Target Loss Prevention / the victim confronted both suspects,C01W03,Night (20:00-23:59)
25-005871,01/21/25,16:00-19:59 Evening Peak,19:00,19:00,Tuesday,January,"Ross Ave, 0 Block",33 Ross Avenue,Motor Vehicle Theft,Motor Vehicle Theft,,,"33 Ross Avenue, Hackensack, NJ, 07601",I1,9,"On January 22, 2025, I responded to the listed location on a report on a stolen motor vehicle. Upon arrival, I met with the registered owner, Kamil Garcia. The registered owner stated on January 21, 2025 at approximately 1800 hours he parked his vehicle, a 2023 Honda Passport color red bearing NJ registration U22RSV in front of 33 Ross Ave facing West. The registered owner stated that he currently has possession of the two key fobs that belong to the vehicle. At approximately 0309 hours on January 22, 2025 he responded to his vehicle where he last parked it and the vehicle was no longer there.       The registered owner received a completed victim notification. The vehicle was entered as stolen into NCIC (NIC #  V956704006) along with a stolen motor vehicle form. The vehicle was also entered as stolen into the  ATTF website. The registered owner does not wish to have the vehicle processed at this time. Approximate value for the above vehicle is 46,000.00 USD.",,,U22RSV,HONDA,PAS,NJ,,,,,Tovbin_S,Complete,P.O. Roselys Salas 369,B4,Det. John Tanucilli 335,Active/Administratively Closed,240 = Theft of Motor Vehicle,9,01/21/25,19:00,01/22/25,03:09,01/22/25,03:10,2025,04,04,21,021,01/21/25 19:00,33,"On January 22, 2025, I responded to the listed location on a report on a stolen motor vehicle. Upon arrival, I met with the registered owner, Kamil Garcia. The registered owner stated on January 21, 2025 at approximately 1800 hours he parked his vehicle, a 2023 Honda Passport color red bearing NJ registration U22RSV in front of 33 Ross Ave facing West. The registered owner stated that he currently has possession of the two key fobs that belong to the vehicle. At approximately 0309 hours on January 22, 2025 he responded to his vehicle where he last parked it and the vehicle was no longer there.       The registered owner received a completed victim notification. The vehicle was entered as stolen into NCIC (NIC #  V956704006) along with a stolen motor vehicle form. The vehicle was also entered as stolen into the  ATTF website. The registered owner does not wish to have the vehicle processed at this time. Approximate value for the above vehicle is 46,000.00 USD.","Vehicle 1: NJ-U22RSV HONDA, PAS",,,C01W04,Evening Peak (16:00-19:59)
25-006083,01/22/25,08:00-11:59 Morning Peak,08:00,08:00,Wednesday,January,"Hudson St, 400 Block",443 Hudson Street,Motor Vehicle Theft,Motor Vehicle Theft,,,"443 Hudson Street, Hackensack, NJ, 07601",E3,5,"On January 22, 2025, I responded to the listed location on a report of a stolen motor vehicle. Upon arrival, I met with the victim, Melisssa Williams, also registered owner. The victim stated the vehicle has been lodged at 443 Hudson Street with permission of the resident Jermal Clark. The victim stated upon speaking to Jermal Clark he stated ""the vehicle was towed off the property early morning and he got some money for it.""  Sgt. Tovbin and I spoke to Jermal Clark, who stated that he does not know which towing company towed the vehicle. I asked Jermal Clark if he towed the vehicle off the property and he was uncooperative in answering the question.       The vehicle, a 2006 Nissan Pathfinder color black bearing NJ registration Y62SRJ, was last seen on January 21, 2025 at approximately 1600 hours parked facing South on the listed property. The victim stated that she currently does not have possession of the key. The victim indicated the one key was last in possession of Jermal Clark.       The registered owner received a completed victim notification. The vehicle was entered as stolen into NCIC (NIC # V146697789 ) along with a stolen motor vehicle form. The vehicle was also entered as stolen into the  ATTF website. The registered owner does not wish to have the vehicle processed at this time. Approximate value for the above vehicle is 2,500.00 USD.",,,Y62SRJ,NISSAN,PTH,NJ,,,,,Swetits_M,Complete,P.O. Roselys Salas 369,B4,Det. Demetrius Carroll 133,Active/Administratively Closed,240 = Theft of Motor Vehicle,9,01/22/25,08:00,01/22/25,19:13,01/22/25,19:14,2025,04,04,22,022,01/22/25 08:00,443,"On January 22, 2025, I responded to the listed location on a report of a stolen motor vehicle. Upon arrival, I met with the victim, Melisssa Williams, also registered owner. The victim stated the vehicle has been lodged at 443 Hudson Street with permission of the resident Jermal Clark. The victim stated upon speaking to Jermal Clark he stated ""the vehicle was towed off the property early morning and he got some money for it.""  Sgt. Tovbin and I spoke to Jermal Clark, who stated that he does not know which towing company towed the vehicle. I asked Jermal Clark if he towed the vehicle off the property and he was uncooperative in answering the question.       The vehicle, a 2006 Nissan Pathfinder color black bearing NJ registration Y62SRJ, was last seen on January 21, 2025 at approximately 1600 hours parked facing South on the listed property. The victim stated that she currently does not have possession of the key. The victim indicated the one key was last in possession of Jermal Clark.       The registered owner received a completed victim notification. The vehicle was entered as stolen into NCIC (NIC # V146697789 ) along with a stolen motor vehicle form. The vehicle was also entered as stolen into the  ATTF website. The registered owner does not wish to have the vehicle processed at this time. Approximate value for the above vehicle is 2,500.00 USD.","Vehicle 1: NJ-Y62SRJ NISSAN, PTH",,,C01W04,Morning Peak (08:00-11:59)
25-006324,01/23/25,12:00-15:59 Afternoon,15:00,15:00,Thursday,January," Berdan Pl, 100 Block",176  Berdan Place,Sexual Assault,"Sexual Assault, Juvenile Investigation",Juvenile Investigation,,"176  Berdan Place, Hackensack, NJ, 07601",H3,8,"On Thursday, 01/23/2025 I was notified by D/Sgt. Dominguez of a possible sexual assault involving a juvenile. I was advised that 10 y/o S.S. disclosed to a school teacher that her mothers boyfriend has been touching her while her mother was sleeping. This reportedly has occurred on multiple occasions. No further information was available at this time. S.S. is a student at Nelly K. Parker school, who already notified DCP&P as per protocol.    I contacted DCP&P social worker Jennifer Diaz who was assigned to the initial investigation. Ms. Diaz advised me that she was currently enroute to Nelly K. Parker to meet with S.S., and school staff. She advised me that she already contacted BCPO/SVU. I advised her that I will meet her at the school. Upon arrival I met with Ms. Diaz, who advised me that S.S. was set to be picked up from school by another unknown adult possibly the suspect. Due to the circumstances it was determined that S.S. will be transported to BCPO (100 Eisenhower Drive, Paramus NJ) to undergo a forensic interview with SVU. Contact was made to S.S. mother, Ibys Sandoval, who was advised that a police investigation is underway and her presence is required. Ms. Sandoval expressed that she has transportation issues, therefore this agency arranged transport for her.  Det. Reyes responded to pick up Ms. Sandoval at her residence (176 Berdan Place, Hackensack NJ). Ms. Sandoval was transported to Nelly K. Parker to meet up with her daughter, and ultimately transported to BCPO for the interview.   Contact information was limited at the time of this report (See Det. Reyes Supplemental report for further details)",,,,,,,,,,,Bay_F,Complete,Det. Frankie Garrett 323,DET,Det. Evelyn Reyes 336,TOT DCP&P,,9,01/23/25,15:00,,,01/23/25,15:58,2025,04,04,23,023,01/23/25 15:00,176,"On Thursday, 01/23/2025 I was notified by D/Sgt. Dominguez of a possible sexual assault involving a juvenile. I was advised that 10 y/o S.S. disclosed to a school teacher that her mothers boyfriend has been touching her while her mother was sleeping. This reportedly has occurred on multiple occasions. No further information was available at this time. S.S. is a student at Nelly K. Parker school, who already notified DCP&P as per protocol.    I contacted DCP&P social worker Jennifer Diaz who was assigned to the initial investigation. Ms. Diaz advised me that she was currently enroute to Nelly K. Parker to meet with S.S., and school staff. She advised me that she already contacted BCPO/SVU. I advised her that I will meet her at the school. Upon arrival I met with Ms. Diaz, who advised me that S.S. was set to be picked up from school by another unknown adult possibly the suspect. Due to the circumstances it was determined that S.S. will be transported to BCPO (100 Eisenhower Drive, Paramus NJ) to undergo a forensic interview with SVU. Contact was made to S.S. mother, Ibys Sandoval, who was advised that a police investigation is underway and her presence is required. Ms. Sandoval expressed that she has transportation issues, therefore this agency arranged transport for her.  Det. Reyes responded to pick up Ms. Sandoval at her residence (176 Berdan Place, Hackensack NJ). Ms. Sandoval was transported to Nelly K. Parker to meet up with her daughter, and ultimately transported to BCPO for the interview.   Contact information was limited at the time of this report (See Det. Reyes Supplemental report for further details)",,suspect,,C01W04,Afternoon (12:00-15:59)
25-006864,01/25/25,08:00-11:59 Morning Peak,11:00,11:00,Saturday,January,"Kansas St, 0 Block",60 Kansas Street,Burglary - Residence,Burglary - Residence,,,"60 Kansas Street, Hackensack, NJ, 07601",E1,5,"On January 25, 2025, at approximately 13:55 hours, P.O. P. Lopez, P.O. G. Lara-Nunez, P.O. Mattalian, Sgt. Competiello, and I responded to 60 Kansas apartment 8F for a possible burglary in progress. Upon arrival, I met with the victim who reported she left her apartment at approximately 11:30 hours. The victim reported approximately 14:00 hours, she returned to the apartment to find the front door slightly ajar.     We did a check of the interior of the apartment which yielded negative results for any suspects inside. The victim reported she is 100% sure the door was locked because she checked multiple times before leaving. The victim reported she was missing about $2,000 in miscellaneous jewelry. She described the jewelry to be earrings and gold necklaces.The victim reported she had the same incident occur in 2023. See 23-091001 for more. The victim reported she observed a light skin Hispanic male driving a black Lexus leaving the apartment complex as she pulled in. The victim reported she recalls the same Lexus and same male in the area after the previous incident.Sgt. Competiello contacted detectives. Detective DeBonis arrived on scene.The victim requested for the apartment to be processed. Sgt. Competiello contacted Bergen County Sheriff's Office. Detective LaSala #1866 arrived on scene. See BCSO case #2025-0052 for more .I observed no signs of forced entry. The New Jersey victim notification form was filled out and a copy was provided to the victim for her records.The crime scene was secured at 14:15 hours.Crime Scene Log:14:31: Det. LaSala Enters14:38: Det. LaSala Exits14:48: Det. Lasala Enters14:49: Det. Debonis Enters15:01: Det. LaSala Exits.15:04: Det. LaSala Enters.Crime Scene Terminated: 15:08",,,,,,,,,,,Levis_R,Complete,P.O. Andres Lopez 375,A2,Det. Matthew DeBonis 325,Active Investigation,220 = Burglary/Breaking & Entering,9,01/25/25,11:00,01/25/25,14:00,01/25/25,13:55,2025,04,04,25,025,01/25/25 11:00,60,"On January 25, 2025, at approximately 13:55 hours, P.O. P. Lopez, P.O. G. Lara-Nunez, P.O. Mattalian, Sgt. Competiello, and I responded to 60 Kansas apartment 8F for a possible burglary in progress. Upon arrival, I met with the victim who reported she left her apartment at approximately 11:30 hours. The victim reported approximately 14:00 hours, she returned to the apartment to find the front door slightly ajar.     We did a check of the interior of the apartment which yielded negative results for any suspects inside. The victim reported she is 100% sure the door was locked because she checked multiple times before leaving. The victim reported she was missing about $2,000 in miscellaneous jewelry. She described the jewelry to be earrings and gold necklaces.The victim reported she had the same incident occur in 2023. See 23-091001 for more. The victim reported she observed a light skin Hispanic male driving a black Lexus leaving the apartment complex as she pulled in. The victim reported she recalls the same Lexus and same male in the area after the previous incident.Sgt. Competiello contacted detectives. Detective DeBonis arrived on scene.The victim requested for the apartment to be processed. Sgt. Competiello contacted Bergen County Sheriff's Office. Detective LaSala #1866 arrived on scene. See BCSO case #2025-0052 for more .I observed no signs of forced entry. The New Jersey victim notification form was filled out and a copy was provided to the victim for her records.The crime scene was secured at 14:15 hours.Crime Scene Log:14:31: Det. LaSala Enters14:38: Det. LaSala Exits14:48: Det. Lasala Enters14:49: Det. Debonis Enters15:01: Det. LaSala Exits.15:04: Det. LaSala Enters.Crime Scene Terminated: 15:08",,suspects inside,"$2,000 in miscellaneous jewelry. She described the jewelry to be earrings and gold necklaces.The victim reported she had the same incident occur in 2023",C01W04,Morning Peak (08:00-11:59)
25-007074,01/25/25,16:00-19:59 Evening Peak,18:00,18:27,Saturday,January,"Stanley Pl, 200 Block",206 Stanley Place,Burglary - Auto,"Burglary - Auto, Theft",Theft,,"206 Stanley Place, Hackensack, NJ, 07601",H3,8,"Suspect description: Possibly male, approximately 5'7'' in height, with a slim build. On 1/26/25 P.O. Papanikolaou and I responded to 206 Stanley Place on a reported theft from auto. Upon arrival, I spoke with the victim, Phyllis Cunningham. The victim reported on 1/25/25 at approximately 20:52 hours she received a text message from her son. The text was a video of an unknown suspect entering her vehicle, New Jersey Registration R36GBB. The listed vehicle was parked in the driveway at 206 Stanley Place. The victim showed me the video that her son texted her. Upon observing the video I observed on 1/25/25 at 18:27 hours the suspect entered the vehicle from the front driver side door, which was left insecure. Later, the suspect was seen on video to be searching through the vehicle. After the incident the victim responded to check her vehicle. Upon inspecting her vehicle nothing appeared to be stolen and no damage was observed. A New Jersey victim notification form was completed. The victim did not request to have the vehicle processed. At this time the victim reported if the suspect could be identified she would pursue a criminal case.  The victim was advised to save the video surveillance of the incident. Sgt. Competiello was advised.",,,R36GBB,HONDA,CRV,NJ,,,,,Levis_R,Complete,P.O. Massimo Gallorini 379,A2,Sgt. Franklin Bay 162,No Investigation,23F = Theft From Motor Vehicle,9,01/25/25,18:27,,,01/26/25,10:34,2025,04,04,25,025,01/25/25 18:27,206,"Suspect description: Possibly male, approximately 5'7'' in height, with a slim build. On 1/26/25 P.O. Papanikolaou and I responded to 206 Stanley Place on a reported theft from auto. Upon arrival, I spoke with the victim, Phyllis Cunningham. The victim reported on 1/25/25 at approximately 20:52 hours she received a text message from her son. The text was a video of an unknown suspect entering her vehicle, New Jersey Registration R36GBB. The listed vehicle was parked in the driveway at 206 Stanley Place. The victim showed me the video that her son texted her. Upon observing the video I observed on 1/25/25 at 18:27 hours the suspect entered the vehicle from the front driver side door, which was left insecure. Later, the suspect was seen on video to be searching through the vehicle. After the incident the victim responded to check her vehicle. Upon inspecting her vehicle nothing appeared to be stolen and no damage was observed. A New Jersey victim notification form was completed. The victim did not request to have the vehicle processed. At this time the victim reported if the suspect could be identified she would pursue a criminal case.  The victim was advised to save the video surveillance of the incident. Sgt. Competiello was advised.","Vehicle 1: NJ-R36GBB HONDA, CRV","suspect description: possibly male, approximately 5'7'' in height, with a slim build suspect entering her vehicle, new jersey registration r36gbb suspect entered the vehicle from the front driver side door, which was left insecure suspect was seen on video to be searching through the vehicle suspect could be identified she would pursue a criminal case",,C01W04,Evening Peak (16:00-19:59)
