Case Number,INC_DATE,TOD,Start of Hour,INC_TIME,Day Name,Month Name,BLOCK,Location,Incident Type_1,ALL_INCIDENTS,Incident Type_2,Incident Type_3,FullAddress,Grid,Zone,Narrative,Total Value Stolen,Total Value Recover,Registration 1,Make1,Model1,Reg State 1,Registration 2,Reg State 2,Make2,Model2,Reviewed By,CompleteCalc,Officer of Record,Squad,Det_Assigned,Case_Status,NIBRS Classification,CASE_NUMBER_LENGTH,Incident Date,Incident Time,Incident Date_Between,Incident Time_Between,Report Date,Report Time,Year,Week of Year,Week of Month,Day,Day of Year,INC_DATE_AND_TIME,St#,Notes,VEHICLE,Suspect,TOTAL_STOLEN_AMOUNT,REPORT_CYCLE,TIME_OF_DAY
25-013527,02/17/25,20:00-23:59 Night,20:00,20:00,Monday,February," Prospect Ave, 200 Block",240  Prospect Avenue,Exceptionally Cleared/Closed,"Exceptionally Cleared/Closed, Sexual Assault",Sexual Assault,,"240  Prospect Avenue, Hackensack, NJ, 07601",H4,8,"On February 18, 2025, I was advised by Sgt. Tripodi that a female, later identified as Yamini Verma, a victim of sexual assault was going to be seen at Mt. Sinai hospital in New York City.  At approximately 17:00 hours, I received a call from NYPD SVU Detective Woo that Ms. Verma was confirmed a patient at Mt. Sinai Emergency Room and was undergoing the SART Examination.    Det. Tanucilli and I responded to Mt. Sinai emergency room to meet with the victim.  Upon our arrival the RN Rachel stated that the victim was still undergoing the SART examination.  Once the examination was completed Det. Tanucilli and I entered the room and spoke with the victim (BWC was activated).    The victim told us that she was sexually assaulted by the suspect Akashpreet Riar on February 17, 2025.  The victim stated that the suspect is a teacher's assistant at the New York College of Podiatric Medicine, where she attends.  She stated that she was in communication with the suspect because she was looking for a tutor and he offered to help her.  The suspect picked up the victim in a blue Honda (unknown registration) from her residence in New York City at approximately 1930 hours.  The victim and suspect arrived at the suspect's apartment (240 Prospect Avenue, unknown apartment).  The victim and suspect were studying for approximately 1 hours, before both parties started to have a few drinks of alcohol.  The victim stated that the suspect started to approach her and speak in a sexual manner.  The victim stated that she refused his advancements and told him that she is not interested.  The victim stated that the suspect started to grope her breasts, buttocks and thighs while trying to kiss her neck.  The victim felt scared and again tried to push off the suspect.  The victim stated that she went to the bathroom and when she finished and unlocked the door, the suspect forced his way into the bathroom.  She stated that the suspect forced her to pull down her pants and shoved his hand down the front of her pants.  She stated that her head was pushed into the sink and the suspect began to digitally penetrate the victim's vagina.  The victim stated that she told the suspect to stop but felt like she had no control over the situation.  The victim stated that she was then picked up and placed into the bathtub where the suspect inserted his penis into her vagina against her will.  The victim said she was raped for approximately 2 minutes and the suspect ejaculated next to the victim.    The victim stated she was in a daze of confusion and fear.  She stated that the suspect called an UBER for her and she took the ride share back to NYC.  The victim stated that she was in disbelief and called her Dean of the college, Dr. Chusid in the morning (2/18/2025).  The victim stated that she told her dean that she was sexually assaulted, and he then recommended she seek medical attention the the nearest hospital.  At the emergency room,  evidence was collected which included the victim's bra (item #1), shirt (item #2), jeans (item #3) and the SART collection kit (item #4).  The victim stated that she wished to continue with a police investigation.  At that point  I contacted the Bergen County Prosecutor's office and spoke to Det. Chris Miranda.   He instructed me to see if the victim is available to respond to BCPO Headquarters in Paramus for an interview on Wednesday, February  19, 2025 at 1700 hours.  The victim agreed.  The evidence was turned over to Det. Tanucilli . Back at police headquarters, an evidence report was generated and the evidence was secured in temp. evidence locker #3 and the temp. evidence refrigerator.    On February 19, 2025, I responded to the Bergen County Prosecutor's Office to meet with the Special Victim's Unit detectives and the victim.  The victim spoke with Detectives Miranda and Dawson.  After meeting with the BCPO SVU detectives the victim stated that she wanted to apply for a SASPA Protection Order.  She was advised to respond to Hackensack Police Headquarters during business hours to obtain a copy of the police report and then go the Bergen County Superior Court and apply in person for the protection order.  The victim stated that she needs some time before she is ready to proceed with the police investigation.    At this point the case will be placed as Ex-Cleared/Closed pending the victim wanting to proceed with the police investigation with the assistance of BCPO.    (See BCPO Case #BCP-25-00237)",,,,,,,,,,,Bay_F,Complete,Det. Matthew Dogali 338,DET,Det. Matthew Dogali 338,Ex-Cleared / Closed,,9,02/17/25,20:00,02/17/25,23:45,02/18/25,17:39,2025,08,04,17,048,02/17/25 20:00,240,"On February 18, 2025, I was advised by Sgt. Tripodi that a female, later identified as Yamini Verma, a victim of sexual assault was going to be seen at Mt. Sinai hospital in New York City.  At approximately 17:00 hours, I received a call from NYPD SVU Detective Woo that Ms. Verma was confirmed a patient at Mt. Sinai Emergency Room and was undergoing the SART Examination.    Det. Tanucilli and I responded to Mt. Sinai emergency room to meet with the victim.  Upon our arrival the RN Rachel stated that the victim was still undergoing the SART examination.  Once the examination was completed Det. Tanucilli and I entered the room and spoke with the victim (BWC was activated).    The victim told us that she was sexually assaulted by the suspect Akashpreet Riar on February 17, 2025.  The victim stated that the suspect is a teacher's assistant at the New York College of Podiatric Medicine, where she attends.  She stated that she was in communication with the suspect because she was looking for a tutor and he offered to help her.  The suspect picked up the victim in a blue Honda (unknown registration) from her residence in New York City at approximately 1930 hours.  The victim and suspect arrived at the suspect's apartment (240 Prospect Avenue, unknown apartment).  The victim and suspect were studying for approximately 1 hours, before both parties started to have a few drinks of alcohol.  The victim stated that the suspect started to approach her and speak in a sexual manner.  The victim stated that she refused his advancements and told him that she is not interested.  The victim stated that the suspect started to grope her breasts, buttocks and thighs while trying to kiss her neck.  The victim felt scared and again tried to push off the suspect.  The victim stated that she went to the bathroom and when she finished and unlocked the door, the suspect forced his way into the bathroom.  She stated that the suspect forced her to pull down her pants and shoved his hand down the front of her pants.  She stated that her head was pushed into the sink and the suspect began to digitally penetrate the victim's vagina.  The victim stated that she told the suspect to stop but felt like she had no control over the situation.  The victim stated that she was then picked up and placed into the bathtub where the suspect inserted his penis into her vagina against her will.  The victim said she was raped for approximately 2 minutes and the suspect ejaculated next to the victim.    The victim stated she was in a daze of confusion and fear.  She stated that the suspect called an UBER for her and she took the ride share back to NYC.  The victim stated that she was in disbelief and called her Dean of the college, Dr. Chusid in the morning (2/18/2025).  The victim stated that she told her dean that she was sexually assaulted, and he then recommended she seek medical attention the the nearest hospital.  At the emergency room,  evidence was collected which included the victim's bra (item #1), shirt (item #2), jeans (item #3) and the SART collection kit (item #4).  The victim stated that she wished to continue with a police investigation.  At that point  I contacted the Bergen County Prosecutor's office and spoke to Det. Chris Miranda.   He instructed me to see if the victim is available to respond to BCPO Headquarters in Paramus for an interview on Wednesday, February  19, 2025 at 1700 hours.  The victim agreed.  The evidence was turned over to Det. Tanucilli . Back at police headquarters, an evidence report was generated and the evidence was secured in temp. evidence locker #3 and the temp. evidence refrigerator.    On February 19, 2025, I responded to the Bergen County Prosecutor's Office to meet with the Special Victim's Unit detectives and the victim.  The victim spoke with Detectives Miranda and Dawson.  After meeting with the BCPO SVU detectives the victim stated that she wanted to apply for a SASPA Protection Order.  She was advised to respond to Hackensack Police Headquarters during business hours to obtain a copy of the police report and then go the Bergen County Superior Court and apply in person for the protection order.  The victim stated that she needs some time before she is ready to proceed with the police investigation.    At this point the case will be placed as Ex-Cleared/Closed pending the victim wanting to proceed with the police investigation with the assistance of BCPO.    (See BCPO Case #BCP-25-00237)",,"suspect akashpreet riar on february 17, 2025 suspect is a teacher's assistant at the new york college of podiatric medicine, where she attends suspect because she was looking for a tutor and he offered to help her suspect picked up the victim in a blue honda (unknown registration) from her residence in new york city at approximately 1930 hours suspect arrived at the  suspect's apartment (240 prospect avenue, unknown apartment) suspect were studying for approximately 1 hours, before both parties started to have a few drinks of alcohol suspect started to approach her and speak in a sexual manner suspect started to grope her breasts, buttocks and thighs while trying to kiss her neck suspect suspect forced his way into the bathroom suspect forced her to pull down her pants and shoved his hand down the front of her pants suspect began to digitally penetrate the victim's vagina suspect to stop but felt like she had no control over the situation suspect inserted his penis into her vagina against her will suspect ejaculated next to the victim suspect called an uber for her and she took the ride share back to nyc",,C02W07,Night (20:00-23:59)
25-013091,02/17/25,08:00-11:59 Morning Peak,08:00,08:22,Monday,February,"Second St, 100 Block",100 Second Street,Motor Vehicle Theft,"Motor Vehicle Theft, Recovered Stolen Vehicle",Recovered Stolen Vehicle,,"100 Second Street, Hackensack, NJ, 07601",G3,7,"Suspect(s): Unknown     The victim, Kimberly Trujillo, responded to Police Headquarters on a report of a Motor Vehicle Theft.  Upon arrival, the victim stated that her 2022 grey 4-door Honda Accord bearing NJ reg: L17PUM had been stolen from her apartment complex's parking lot and had been located in Rochelle Park. The victim further stated the listed vehicle was parked in assigned space number #2 and was last known to be parked there at approximately 2300 hours. The victim advised me she was in possession of the master key and no other party had access to her vehicle. The victim further advised me the spare key to her vehicle was misplaced approximately two (2) years in the past. Both license plates were attached to the vehicle at the time the victim parked the vehicle.     The victim stated on 02/17/2025 at approximately 0800, she received a phone call from Rochelle Park Police Department Det. Galina #151 advising her the listed vehicle had been located behind a CrossFit gym in Rochelle Park. Det. Gallina #151 further advised the victim, that the listed vehicle was located with all four (4) wheels removed from the vehicle. The victim further stated upon receiving the phone call, they responded to their second vehicle which was also parked in their apartment complex's parking lot. At this time, the victim observed an E-Z Pass and Camera from the stolen vehicle left on the hood of her second vehicle.      The victim stated she would like to have the vehicle processed should it be recovered and signed a consent to search form. A victim notification form was completed and a copy was given to the victim. The vehicle's insurance information was unable to be provided due to the paperwork being inside the glove box of the stolen vehicle.The vehicle registration was given to dispatch and was entered into NCIC. A stolen vehicle entry was made into the Auto Theft Task Force website.The vehicle's estimated value is approximately $22,000 USD.  See Rochelle Park Case #2025-002492.",,,L17PUM,HONDA,ACC,NJ,,,,,Deleon_A,Complete,P.O. Ruben Almonte 359,A3,Det. Demetrius Carroll 133,Active Investigation,240 = Theft of Motor Vehicle,9,02/17/25,08:22,,,02/17/25,08:22,2025,08,04,17,048,02/17/25 08:22,100,"Suspect(s): Unknown     The victim, Kimberly Trujillo, responded to Police Headquarters on a report of a Motor Vehicle Theft.  Upon arrival, the victim stated that her 2022 grey 4-door Honda Accord bearing NJ reg: L17PUM had been stolen from her apartment complex's parking lot and had been located in Rochelle Park. The victim further stated the listed vehicle was parked in assigned space number #2 and was last known to be parked there at approximately 2300 hours. The victim advised me she was in possession of the master key and no other party had access to her vehicle. The victim further advised me the spare key to her vehicle was misplaced approximately two (2) years in the past. Both license plates were attached to the vehicle at the time the victim parked the vehicle.     The victim stated on 02/17/2025 at approximately 0800, she received a phone call from Rochelle Park Police Department Det. Galina #151 advising her the listed vehicle had been located behind a CrossFit gym in Rochelle Park. Det. Gallina #151 further advised the victim, that the listed vehicle was located with all four (4) wheels removed from the vehicle. The victim further stated upon receiving the phone call, they responded to their second vehicle which was also parked in their apartment complex's parking lot. At this time, the victim observed an E-Z Pass and Camera from the stolen vehicle left on the hood of her second vehicle.      The victim stated she would like to have the vehicle processed should it be recovered and signed a consent to search form. A victim notification form was completed and a copy was given to the victim. The vehicle's insurance information was unable to be provided due to the paperwork being inside the glove box of the stolen vehicle.The vehicle registration was given to dispatch and was entered into NCIC. A stolen vehicle entry was made into the Auto Theft Task Force website.The vehicle's estimated value is approximately $22,000 USD.  See Rochelle Park Case #2025-002492.","Vehicle 1: NJ-L17PUM HONDA, ACC","suspect(s): unknown     the victim, kimberly trujillo, responded to police headquarters on a report of a motor vehicle theft","$22,000 USD.  See Rochelle Park Case #2025-002492.",C02W07,Morning Peak (08:00-11:59)
25-013106,02/17/25,08:00-11:59 Morning Peak,09:00,09:31,Monday,February,"Prospect Ave, 0 Block",30 Prospect Avenue,Motor Vehicle Theft,Motor Vehicle Theft,,,"30 Prospect Avenue, Hackensack, NJ, 07601",G4,7,"On February 17, 2025 I responded to 300 Atlantic Street (HUMC Parking Garage) on a report of a motor vehicle theft. Upon arrival, I met with the victim who is the registered owner of the vehicle and his wife. The victim advised me that his wife parked the vehicle (2020 Honda Accord blue) inside the monthly permit parking section near the entrance of the garage at approximately 2000 hours last night. This morning around 0900 hours they arrived to the garage and discovered that the vehicle was missing. They advised me that they only have one key and checked the area for the vehicle but were met with negative results. I advised Headquarters to check if the vehicle was towed from the premises which also yielded negative results. At this time I advised the registered owner the procedure with reporting a stolen vehicle. At this time he stated he wanted the vehicle processed and signed a consent to search form. A victim notification form was also completed and a copy was provided to the victim. Upon completion the vehicle was placed into NCIC and ATTF as stolen.",,,Z53RVG,HONDA,ACC,NJ,,,,,Deleon_A,Complete,P.O. Anzour Marza 356,A3,Det. Demetrius Carroll 133,Active/Administratively Closed,240 = Theft of Motor Vehicle,9,02/17/25,09:31,,,02/17/25,09:31,2025,08,04,17,048,02/17/25 09:31,30,"On February 17, 2025 I responded to 300 Atlantic Street (HUMC Parking Garage) on a report of a motor vehicle theft. Upon arrival, I met with the victim who is the registered owner of the vehicle and his wife. The victim advised me that his wife parked the vehicle (2020 Honda Accord blue) inside the monthly permit parking section near the entrance of the garage at approximately 2000 hours last night. This morning around 0900 hours they arrived to the garage and discovered that the vehicle was missing. They advised me that they only have one key and checked the area for the vehicle but were met with negative results. I advised Headquarters to check if the vehicle was towed from the premises which also yielded negative results. At this time I advised the registered owner the procedure with reporting a stolen vehicle. At this time he stated he wanted the vehicle processed and signed a consent to search form. A victim notification form was also completed and a copy was provided to the victim. Upon completion the vehicle was placed into NCIC and ATTF as stolen.","Vehicle 1: NJ-Z53RVG HONDA, ACC",,,C02W07,Morning Peak (08:00-11:59)
25-013147,02/17/25,12:00-15:59 Afternoon,12:00,12:35,Monday,February,"Pangborn Pl, 0 Block",35 Pangborn Place,Burglary - Commercial,"Burglary - Commercial, Suspicious Incident",Suspicious Incident,,"35 Pangborn Place, Hackensack, NJ, 07601",I1,9,"Suspect(s): Unknown     I responded to the listed location, 35 Pangborn Place - Hackensack Emergency Dental, on a report of a burglary. Upon arrival, I was met by the complainant, Beau Jin, who is the manager of the business. The complainant stated that a TP-Link 300 Mbps Wireless Router ($100.00 USD) and a Keep Connect Router Reporter ($50.00) had been a taken from the basement. The complainant further stated there did not appear to be any forced entry into the basement. I was then advised by the complainant that the basement was accessible by the employees as well as the residence of the apartments on the second and third floor.     The complainant advised me the business was closed and secured for on 02/14/2025 until 02/16/2025. The complainant further advised me he on 02/15/2025 he observed through his phone that the businesses router was inoperable. The complainant stated upon opening business on 02/17/2025 he responded to the basement and observed that the router was taken. The complainant further reported he observed feces on the handle of the main entrance door and in the amazon drop off box located in front of the business.      The scene was unable to be processed due to the complainant contamination the scene as well as the fecal matter contaminating the door handle.Sgt. Farhi was notified. Detectives were notified by Sgt. Farhi. Total value of items taken - $150.00 USD",,,,,,,,,,,Deleon_A,Complete,P.O. Ruben Almonte 359,A3,Sgt. Francesco Tripodi 134,Under Supervisor Review,220 = Burglary/Breaking & Entering,9,02/17/25,12:35,,,02/17/25,12:35,2025,08,04,17,048,02/17/25 12:35,35,"Suspect(s): Unknown     I responded to the listed location, 35 Pangborn Place - Hackensack Emergency Dental, on a report of a burglary. Upon arrival, I was met by the complainant, Beau Jin, who is the manager of the business. The complainant stated that a TP-Link 300 Mbps Wireless Router ($100.00 USD) and a Keep Connect Router Reporter ($50.00) had been a taken from the basement. The complainant further stated there did not appear to be any forced entry into the basement. I was then advised by the complainant that the basement was accessible by the employees as well as the residence of the apartments on the second and third floor.     The complainant advised me the business was closed and secured for on 02/14/2025 until 02/16/2025. The complainant further advised me he on 02/15/2025 he observed through his phone that the businesses router was inoperable. The complainant stated upon opening business on 02/17/2025 he responded to the basement and observed that the router was taken. The complainant further reported he observed feces on the handle of the main entrance door and in the amazon drop off box located in front of the business.      The scene was unable to be processed due to the complainant contamination the scene as well as the fecal matter contaminating the door handle.Sgt. Farhi was notified. Detectives were notified by Sgt. Farhi. Total value of items taken - $150.00 USD",,"suspect(s): unknown     i responded to the listed location, 35 pangborn place - hackensack emergency dental, on a report of a burglary",$100.00 USD) and a Keep Connect Router Reporter ( $50.00) had been a taken from the basement. The complainant further stated there did not appear to be any forced entry into the basement $150.00 USD,C02W07,Afternoon (12:00-15:59)
25-014007,02/20/25,12:00-15:59 Afternoon,12:00,12:52,Tuesday,February,"Union St, 300 Block",360 Union Street,Sexual Assault,Sexual Assault,,,"360 Union Street, Hackensack, NJ, 07601",H2,8,"On February 20, 2025 I responded to 360 Union Street, Hackensack Middle school on a report of sexual assault involving a minor. Det. James was also present at the time as we spoke to the 7th grade Councilor, Mrs. Odumosu, in regard to the incident. Mr. Sass and Mr. Ruiz were also present at this time.           Mrs. Odumasu stated that she spoke to the victim A.D.(12) and was informed the following. A.D.(12) had stated that she was being sexually assaulted by her older brother A.D. (18) approximately 2-3 times a year since she was in first grade at the approximate age of 5 years old. When asked what type of sexual assault took place, she stated penetration occurred. In one instance she stated that a cousin was present and witness the assault, but did not specify the cousin by name. A.D.(12) stated that the last assault occurred some time in June or September of 2024. When asked if she had ever told anyone she stated she told her mother after every incident to which her mother responded by saying that her and her brother would have to learn to coexist and work past it because she did not want to call the police and have to pick between both her children.Det. Reyes was advised all investigation turned over to Dete",,,,,,,,,,,Deleon_A,Complete,P.O. Angie Tabares 363,A3,Det. Frankie Garrett 323,Cleared - Arrest,36A = Incest,9,06/20/17,12:52,09/20/24,,02/20/25,12:52,2017,25,04,20,171,06/20/17 12:52,360,"On February 20, 2025 I responded to 360 Union Street, Hackensack Middle school on a report of sexual assault involving a minor. Det. James was also present at the time as we spoke to the 7th grade Councilor, Mrs. Odumosu, in regard to the incident. Mr. Sass and Mr. Ruiz were also present at this time.           Mrs. Odumasu stated that she spoke to the victim A.D.(12) and was informed the following. A.D.(12) had stated that she was being sexually assaulted by her older brother A.D. (18) approximately 2-3 times a year since she was in first grade at the approximate age of 5 years old. When asked what type of sexual assault took place, she stated penetration occurred. In one instance she stated that a cousin was present and witness the assault, but did not specify the cousin by name. A.D.(12) stated that the last assault occurred some time in June or September of 2024. When asked if she had ever told anyone she stated she told her mother after every incident to which her mother responded by saying that her and her brother would have to learn to coexist and work past it because she did not want to call the police and have to pick between both her children.Det. Reyes was advised all investigation turned over to Dete",,,,C02W08,Afternoon (12:00-15:59)
